[
  {
    "id": 1,
    "branch_code": "7558",
    "name": "Banco Meridiano Terrassa Oeste",
    "city": "Terrassa",
    "province": "Barcelona",
    "address": "Avenida de San José, 109, 6º B",
    "postal_code": "08073",
    "phone": "+34 933 653 722",
    "opened_at": "2004-12-05"
  },
  {
    "id": 2,
    "branch_code": "1665",
    "name": "Banco Meridiano Santander Oeste",
    "city": "Santander",
    "province": "Cantabria",
    "address": "Avenida de los Olivos, 130",
    "postal_code": "39054",
    "phone": "+34 942 039 414",
    "opened_at": "2015-06-28"
  },
  {
    "id": 3,
    "branch_code": "2166",
    "name": "Banco Meridiano Valencia La Alameda",
    "city": "Valencia",
    "province": "Valencia",
    "address": "Calle de la Iglesia, 95, 7º Izq.",
    "postal_code": "46029",
    "phone": "+34 960 931 903",
    "opened_at": "1985-09-16"
  },
  {
    "id": 4,
    "branch_code": "1342",
    "name": "Banco Meridiano Málaga Casco Antiguo",
    "city": "Málaga",
    "province": "Málaga",
    "address": "Calle del Carmen, 117",
    "postal_code": "29037",
    "phone": "+34 952 692 271",
    "opened_at": "2018-10-23"
  },
  {
    "id": 5,
    "branch_code": "8264",
    "name": "Banco Meridiano Córdoba Ensanche",
    "city": "Córdoba",
    "province": "Córdoba",
    "address": "Calle de la Constitución, 48",
    "postal_code": "14052",
    "phone": "+34 957 970 900",
    "opened_at": "2009-11-13"
  },
  {
    "id": 6,
    "branch_code": "1179",
    "name": "Banco Meridiano Barcelona Oeste",
    "city": "Barcelona",
    "province": "Barcelona",
    "address": "Carrer de la Libertad, 13",
    "postal_code": "08055",
    "phone": "+34 935 892 193",
    "opened_at": "1993-07-01"
  },
  {
    "id": 7,
    "branch_code": "1403",
    "name": "Banco Meridiano Vigo Norte",
    "city": "Vigo",
    "province": "Pontevedra",
    "address": "Calle de Antonio Machado, 171, 9º C",
    "postal_code": "36038",
    "phone": "+34 986 182 879",
    "opened_at": "2002-03-01"
  },
  {
    "id": 8,
    "branch_code": "3061",
    "name": "Banco Meridiano Badajoz Oeste",
    "city": "Badajoz",
    "province": "Badajoz",
    "address": "Calle de Galicia, 99",
    "postal_code": "06047",
    "phone": "+34 924 610 052",
    "opened_at": "2019-04-04"
  },
  {
    "id": 9,
    "branch_code": "4497",
    "name": "Banco Meridiano Alcorcón Oeste",
    "city": "Alcorcón",
    "province": "Madrid",
    "address": "Calle de la Libertad, 178, 7º Dcha.",
    "postal_code": "28030",
    "phone": "+34 910 081 864",
    "opened_at": "1987-12-26"
  },
  {
    "id": 10,
    "branch_code": "6763",
    "name": "Banco Meridiano Sevilla Este",
    "city": "Sevilla",
    "province": "Sevilla",
    "address": "Calle de la Merced, 137",
    "postal_code": "41080",
    "phone": "+34 954 897 745",
    "opened_at": "1985-12-08"
  },
  {
    "id": 11,
    "branch_code": "3597",
    "name": "Banco Meridiano Córdoba Nuevos Ministerios",
    "city": "Córdoba",
    "province": "Córdoba",
    "address": "Calle de la Libertad, 35, 2º C",
    "postal_code": "14052",
    "phone": "+34 957 498 623",
    "opened_at": "1994-04-09"
  },
  {
    "id": 12,
    "branch_code": "5015",
    "name": "Banco Meridiano Ourense Casco Antiguo",
    "city": "Ourense",
    "province": "Ourense",
    "address": "Calle de la Estación, 136",
    "postal_code": "32011",
    "phone": "+34 988 224 088",
    "opened_at": "2004-01-10"
  },
  {
    "id": 13,
    "branch_code": "5954",
    "name": "Banco Meridiano Tarragona Nuevos Ministerios",
    "city": "Tarragona",
    "province": "Tarragona",
    "address": "Calle de la Paz, 136, 7º C",
    "postal_code": "43078",
    "phone": "+34 977 463 893",
    "opened_at": "1992-03-07"
  },
  {
    "id": 14,
    "branch_code": "3240",
    "name": "Banco Meridiano Barcelona Este",
    "city": "Barcelona",
    "province": "Barcelona",
    "address": "Carrer Colón, 175",
    "postal_code": "08080",
    "phone": "+34 935 969 816",
    "opened_at": "2019-09-24"
  },
  {
    "id": 15,
    "branch_code": "0800",
    "name": "Banco Meridiano Salamanca Casco Antiguo",
    "city": "Salamanca",
    "province": "Salamanca",
    "address": "Calle de la Libertad, 53",
    "postal_code": "37006",
    "phone": "+34 923 603 317",
    "opened_at": "2013-10-31"
  },
  {
    "id": 16,
    "branch_code": "8644",
    "name": "Banco Meridiano Logroño Este",
    "city": "Logroño",
    "province": "La Rioja",
    "address": "Calle de Andalucía, 29, 6º C",
    "postal_code": "26047",
    "phone": "+34 941 063 091",
    "opened_at": "2019-09-08"
  },
  {
    "id": 17,
    "branch_code": "9087",
    "name": "Banco Meridiano Las Palmas de Gran Canaria Este",
    "city": "Las Palmas de Gran Canaria",
    "province": "Las Palmas",
    "address": "Avenida Velázquez, 82",
    "postal_code": "35013",
    "phone": "+34 928 158 653",
    "opened_at": "1987-10-17"
  },
  {
    "id": 18,
    "branch_code": "9997",
    "name": "Banco Meridiano Madrid Casco Antiguo",
    "city": "Madrid",
    "province": "Madrid",
    "address": "Calle Real, 100, 2º B",
    "postal_code": "28029",
    "phone": "+34 916 831 869",
    "opened_at": "2008-05-13"
  },
  {
    "id": 19,
    "branch_code": "9984",
    "name": "Banco Meridiano Guadalajara Norte",
    "city": "Guadalajara",
    "province": "Guadalajara",
    "address": "Calle del Ebro, 6",
    "postal_code": "19024",
    "phone": "+34 949 775 374",
    "opened_at": "1994-08-25"
  },
  {
    "id": 20,
    "branch_code": "6710",
    "name": "Banco Meridiano Huesca Casco Antiguo",
    "city": "Huesca",
    "province": "Huesca",
    "address": "Calle de San Antonio, 34",
    "postal_code": "22016",
    "phone": "+34 974 649 117",
    "opened_at": "1998-02-19"
  },
  {
    "id": 21,
    "branch_code": "9623",
    "name": "Banco Meridiano Madrid Oeste",
    "city": "Madrid",
    "province": "Madrid",
    "address": "Plaza de las Acacias, 171, 6º D",
    "postal_code": "28062",
    "phone": "+34 914 133 217",
    "opened_at": "2004-02-04"
  },
  {
    "id": 22,
    "branch_code": "9590",
    "name": "Banco Meridiano Almería Este",
    "city": "Almería",
    "province": "Almería",
    "address": "Calle de Blas de Otero, 157",
    "postal_code": "04010",
    "phone": "+34 950 659 931",
    "opened_at": "2003-12-27"
  },
  {
    "id": 23,
    "branch_code": "2753",
    "name": "Banco Meridiano Murcia Oeste",
    "city": "Murcia",
    "province": "Murcia",
    "address": "Plaza del Duero, 135",
    "postal_code": "30031",
    "phone": "+34 968 023 143",
    "opened_at": "2008-10-13"
  },
  {
    "id": 24,
    "branch_code": "7096",
    "name": "Banco Meridiano Madrid Casco Antiguo",
    "city": "Madrid",
    "province": "Madrid",
    "address": "Calle de la Rosa, 113",
    "postal_code": "28047",
    "phone": "+34 919 386 166",
    "opened_at": "2000-12-08"
  },
  {
    "id": 25,
    "branch_code": "4896",
    "name": "Banco Meridiano Madrid Oeste",
    "city": "Madrid",
    "province": "Madrid",
    "address": "Avenida Goya, 127",
    "postal_code": "28036",
    "phone": "+34 919 881 137",
    "opened_at": "2017-04-30"
  }
]
